id;nome;codigo;situacao;cat_administrativa;dep_administrativa;cep;bairro_id;endereco;zona;lat;long;Telefone;email;extensao;porte
1;CM DE TEMPO INTEGRAL CIVICO-MILITAR CAIC MISAEL AGUILAR;29362415;Ativa;Publica;Municipal;48916-773;;RUA DOM LUCAS MOREIRA NEVES, S/N ANTONIO CONSELHEIRO.;Urbana;-9.44172;-40.51409333;(74) 988170630;;NÃO;Entre 501 e 1000 matrículas de escolarização
2;EM 02 DE JULHO;29024935;Ativa;Publica;Municipal;48921-000;;AVENIDA DOS COLONOS, MANICOBA NH 1.;Rural;;;(74) 988242009;;NÃO;Entre 501 e 1000 matrículas de escolarização
3;EM 15 DE JULHO;29024994;Ativa;Publica;Municipal;48921-000;;LOCALIDADE RUA DA BIS/NAGA S/N, PREDIO. PROJETO MANICOBA NH II.;Rural;-9.282946028;-40.28287411;;;NÃO;Entre 501 e 1000 matrículas de escolarização
4;EM 25 DE JULHO;29026130;Ativa;Publica;Municipal;48923-000;;MANDACARU I, S/N ZONA RURAL.;Rural;;;(74) 88068024;;NÃO;Entre 201 e 500 matrículas de escolarização
5;EM AMERICO TANURI - JUNCO;29026601;Ativa;Publica;Municipal;48922-200;;POVOADO GOIABEIRA 1, S/N SALITRE.;Rural;-9.80525502;-40.61377237;;;NÃO;Até 50 matrículas de escolarização
6;EM AMERICO TANURI - MANICOBA;29026148;Ativa;Publica;Municipal;48921-000;;POVOADO LAGOA DA PEDRA, S/N MANICOBA.;Rural;-9.334298333;-40.24413167;(74) 36123354;;NÃO;Até 50 matrículas de escolarização
7;EM ANALIA BARBOSA DE SOUZA;29341256;Ativa;Publica;Municipal;48913-642;;AVENIDA AVENIDA CHEFFY KHOURY, ESCOLA. ANTONIO GUILHERMINO.;Urbana;-9.46465875;-40.49610734;(74) 91552384;;NÃO;Entre 501 e 1000 matrículas de escolarização
8;EM ANTONIO FRANCISCO DE OLIVEIRA;29026482;Ativa;Publica;Municipal;48922-200;;GOIABEIRA II, S/N PREDIO. SALITRE.;Rural;-9.813363;-40.60178;(74) 36123354;;NÃO;Entre 201 e 500 matrículas de escolarização
9;EM ARGEMIRO JOSE DA CRUZ;29429536;Ativa;Publica;Municipal;48916-407;;AVENIDA AVENIDA DO CRUZEIRO, 15 ARGEMIRO.;Urbana;-9.438686667;-40.51861167;(74) 36110018;;NÃO;Entre 501 e 1000 matrículas de escolarização
10;EM BOM JESUS - BARAUNA ITAMOTINGA;29026156;Ativa;Publica;Municipal;48923-000;;FAZENDA BARAUNA, S/N ITAMOTINGA.;Rural;-9.328824165;-39.99959059;(74) 36187055;;NÃO;Até 50 matrículas de escolarização
11;EM BOM JESUS - NH I CURACA;29025907;Ativa;Publica;Municipal;48923-000;;PRJETO CURACA NH1, S/N ITAMOTINGA.;Rural;-9.14763755;-40.08558748;(74) 99777510;;NÃO;Entre 201 e 500 matrículas de escolarização
12;EM CAXANGA;29024650;Ativa;Publica;Municipal;48908-526;;VILA CAXANGA- AREA V-AGROVALE, S/N PREDIO. JARDIM PRIMAVERA.;Urbana;-9.462607889;-40.43853066;(74) 988489702;;NÃO;Entre 51 e 200 matrículas de escolarização
13;EM CELSO CAVALCANTE DE CARVALHO;29025346;Ativa;Publica;Municipal;48920-899;;CAIXA POSTAL COMUNITARIA RUA UM, S/N - PROJETO MANDACARU, S/N PROJETO MANDACARU.;Rural;-9.38678096;-40.42623885;(74) 36177007;;NÃO;Entre 501 e 1000 matrículas de escolarização
14;EM CENTRO SOCIAL URBANO AMERICO TANURI;29024668;Ativa;Publica;Municipal;48905-499;;RUA 01, S/Nº LOTEAMENTO PIO XI. ALTO DO ALENCAR.;Urbana;-9.43650431;-40.49376487;(74) 36112744;;NÃO;Entre 201 e 500 matrículas de escolarização
15;EM CORACAO DE JESUS - JUREMA VERMELHA;29025974;Ativa;Publica;Municipal;48921-000;;POVOADO JUREMA VERMELHA, S/N MANICOBA VELHA.;Rural;-9.19795652;-40.26476887;(74) 998183008;;NÃO;Entre 51 e 200 matrículas de escolarização
16;EM CORACAO DE JESUS - SERRA DA MADEIRA;29026164;Ativa;Publica;Municipal;48923-000;;FAZENDA SERRA DA MADEIRA, S/N DISTRITO DE ITAMOTINGA.;Rural;-9.258782007;-39.98916099;(74) 36187055;;NÃO;Entre 51 e 200 matrículas de escolarização
17;EM DE JATOBA;29025583;Ativa;Publica;Municipal;48921-000;;RUA DAS ALGAROBAS, S/N POVOADO DE JATOBA. MANICOBA.;Rural;-9.2888081;-40.30920755;(74) 36123354;;NÃO;Entre 51 e 200 matrículas de escolarização
18;EM DE PONTAL;29026431;Ativa;Publica;Municipal;48923-970;;POVOADO DE PONTAL, S/N ZONA RURAL.;Rural;-9.08091625;-40.2025726;(74) 988727248;;NÃO;Entre 201 e 500 matrículas de escolarização
19;EM DE TEMPO INTEGRAL PEDRO DIAS;29025834;Ativa;Publica;Municipal;48922-970;;RUA DO COMERCIO, S/N, CENTRO.;Rural;-9.586945;-40.42644333;(74) 988223271;;NÃO;Entre 51 e 200 matrículas de escolarização
20;EM DE TEMPO INTEGRAL PROFª IRACEMA PEREIRA DA PAIXAO;29450004;Ativa;Publica;Municipal;48904-711;;RUA RUA EDGARD CHASTINET, 00 SAO GERALDO.;Urbana;-9.422457358;-40.48349177;(74) 36123354;;NÃO;Entre 51 e 200 matrículas de escolarização
21;EM DEPUTADO RAIMUNDO DA CUNHA LEITE;29026890;Ativa;Publica;Municipal;48922-400;;LOCALIDADE, ESCOLA. JUREMAL.;Rural;-9.73059904;-40.3603198;(74) 36175002;;NÃO;Entre 51 e 200 matrículas de escolarização
22;EM DOM AVELAR BRANDAO VILELA;29024927;Ativa;Publica;Municipal;48904-621;;R. QUADRA 13, S/N PREDIO. JOAO PAULO II.;Urbana;-9.47396749;-40.49754378;(74) 36125265;;NÃO;Entre 501 e 1000 matrículas de escolarização
23;EM DOUTOR EDSON RIBEIRO;29026024;Ativa;Publica;Municipal;48921-000;;POVOADO DE CONCHAS, S/N CONCHAS. MANICOBA.;Rural;-9.26713237;-40.2988618;(74) 36123354;;NÃO;Entre 51 e 200 matrículas de escolarização
24;EM DURVAL BARBOSA DA CUNHA;29026911;Ativa;Publica;Municipal;48920-899;;POVOADO DE POCOES, AREA RURAL DE JUAZEIRO.;Rural;;;(74) 36175004;;NÃO;Até 50 matrículas de escolarização
25;EM EDUCANDARIO JOAO XXIII;29401610;Ativa;Publica;Municipal;48900-120;;RUA IMACULADA CONCEICAO, S/N PIRANGA.;Urbana;-9.43557486;-40.50333891;;;NÃO;Entre 201 e 500 matrículas de escolarização
26;EM ELISEU SANTOS;29026113;Ativa;Publica;Municipal;48923-000;;PROJETO CURACA - CAJ, S/N PREDIO. ITAMOTINGA.;Rural;-9.177963333;-40.02425833;(74) 36173089;;NÃO;Entre 51 e 200 matrículas de escolarização
27;EM ESTACAO DO SABER JOSE CARLOS TANURI;29480027;Ativa;Publica;Municipal;48900-160;;RUA DA ESTACAO, 77 PIRANGA.;Urbana;-9.42954777;-40.50367505;;;NÃO;Entre 51 e 200 matrículas de escolarização
28;EM EURIDICE RIBEIRO VIANA;29026199;Ativa;Publica;Municipal;48920-899;;QUIPA, AREA RURAL DE JUAZEIRO.;Rural;-9.376066416;-40.35038958;(74) 99883138;;NÃO;Entre 51 e 200 matrículas de escolarização
29;EM FAMILIA UNIDA;29026202;Ativa;Publica;Municipal;48921-000;;RIACHO DA MASSAROCA, S/N PREDIO. MANICOBA.;Rural;-9.305575;-40.19206833;(74) 88367939;;NÃO;Até 50 matrículas de escolarização
30;EM HELENA CELESTINO MAGALHAES;29025087;Ativa;Publica;Municipal;48906-608;;R. QUADRA B, 00765 CASTELO BRANCO.;Urbana;-9.438700522;-40.49246879;(74) 36124378;;NÃO;Entre 501 e 1000 matrículas de escolarização
31;EM JOAO DIAS FERREIRA;29026741;Ativa;Publica;Municipal;48922-200;;POVOADO DE ALFAVACA, S/N SALITRE.;Rural;-9.623676667;-40.64615333;;;NÃO;Entre 51 e 200 matrículas de escolarização
32;EM JOAO NEVES DE ALMEIDA;29025222;Ativa;Publica;Municipal;48922-200;;POVOADO DE MARRUA, SALITRE.;Rural;-9.766072808;-40.60344729;(74) 36123354;;NÃO;Entre 51 e 200 matrículas de escolarização
33;EM JOCA DE SOUZA OLIVEIRA;29025168;Ativa;Publica;Municipal;48902-503;;RUA CARLOS DRUMOND DE ANDRADE, 29 MARINGA.;Urbana;-9.41599597;-40.51427527;(74) 36110041;;NÃO;Entre 201 e 500 matrículas de escolarização
34;EM JOSE DE AMORIM;29026636;Ativa;Publica;Municipal;48922-971;;UNIDADE OPERACIONAL RUA PRINCIPAL, S/N JUNCO.;Rural;-9.48654334;-40.61555224;(74) 988183313;;NÃO;Entre 201 e 500 matrículas de escolarização
35;EM JOSE PADILHA DE SOUZA;29025370;Ativa;Publica;Municipal;48905-259;;RUA RUA SANTA HELENA, S/N ALTO DO CRUZEIRO.;Urbana;-9.428161;-40.49674;(74) 36120372;;NÃO;Entre 201 e 500 matrículas de escolarização
36;EM JUDITE LEAL COSTA;29025176;Ativa;Publica;Municipal;48904-245;;TRAVESSA PAULO VI, S/N SANTA MARIA GORETTI.;Urbana;-9.41948283;-40.499407;(74) 36114939;;NÃO;Entre 201 e 500 matrículas de escolarização
37;EM LINDAURA MARIA DE JESUS;29025923;Ativa;Publica;Municipal;48924-000;;FAZENDA RODEADOR,;Rural;;;(74) 999777510;;NÃO;Até 50 matrículas de escolarização
38;EM LUCIA CARMEM SOBREIRA;29026644;Ativa;Publica;Municipal;48922-200;;POVOADO DE HORTO FLORESTAL, S/N SALITRE.;Rural;-9.453831667;-40.51304;(74) 91001290;;NÃO;Entre 51 e 200 matrículas de escolarização
39;EM LUDGERO DE SOUZA COSTA;29025184;Ativa;Publica;Municipal;48904-375;;RUA SANTA TEREZINHA, S/N LOMANTO JUNIOR.;Urbana;-9.42504242;-40.49675783;(74) 36121731;;NÃO;Entre 201 e 500 matrículas de escolarização
40;EM LUIS CURSINO DA FRANCA CARDOSO;29024714;Ativa;Publica;Municipal;48906-680;;CAMINHO CAMINHO 12, S/N RUA C. TANCREDO NEVES.;Urbana;-9.443231318;-40.48944033;;;NÃO;Entre 201 e 500 matrículas de escolarização
41;EM MANDACARU;29025206;Ativa;Publica;Municipal;48908-524;;AVENIDA MANDACARU, S/N JARDIM PRIMAVERA.;Urbana;-9.45571047;-40.41721123;;;NÃO;Entre 201 e 500 matrículas de escolarização
42;EM MANOEL DE SOUZA BONFIM;29025672;Ativa;Publica;Municipal;48922-700;;AVENIDA ALFREDO VIANA, 37 DISTITO DE ABOBORA.;Rural;;;(74) 36179072;;NÃO;Entre 201 e 500 matrículas de escolarização
43;EM MANOEL GOMES MARTINS;29026440;Ativa;Publica;Municipal;48920-899;;PORTO DE PEDRA, PROJETO MANDACARU.;Rural;-9.370129975;-40.43047146;(74) 36110549;;NÃO;Entre 51 e 200 matrículas de escolarização
44;EM MANOEL LUIZ DA SILVA;29026296;Ativa;Publica;Municipal;48921-000;;POVOADO DE CAMPOS, S/N PREDIO. MANICOBA.;Rural;-9.353545;-40.23555333;(74) 36123354;;NÃO;Entre 51 e 200 matrículas de escolarização
45;EM MANOEL NUNES AMORIM;29341710;Ativa;Publica;Municipal;48920-899;;RUA PRINCIPAL, S/N SEDE. JUNCO - SALITRE - AREA RURAL DE JUAZEIRO.;Rural;-9.674534043;-40.60536875;(74) 36115110;;NÃO;Entre 51 e 200 matrículas de escolarização
46;EM MARIA DO CARMO SA NOGUEIRA;29026652;Ativa;Publica;Municipal;48922-200;;FAZENDA SOBRADINHO, S/N SALITRE.;Rural;-9.855908333;-40.62895833;(74) 988521337;;NÃO;Até 50 matrículas de escolarização
47;EM MARIA MONTEIRO BACELAR;29026660;Ativa;Publica;Municipal;48922-200;;LOCALIDADE, 95 RODEADOURO.;Rural;-9.4710053;-40.57250341;(74) 36184001;;NÃO;Entre 51 e 200 matrículas de escolarização
48;EM MARIANO RODRIGUES DE SOUZA;29025230;Ativa;Publica;Municipal;48923-000;;POVOADO DE GUANHAES, CASA. ITAMOTINGA.;Rural;-9.09635162;-40.09815968;(74) 36173009;;NÃO;Entre 51 e 200 matrículas de escolarização
49;EM MIGUEL ANGELO DE SOUZA;29026679;Ativa;Publica;Municipal;48922-200;;LOCALIDADE CURRAL NOVO, SALITRE.;Rural;-9.52456037;-40.64385805;(74) 91001290;;NÃO;Entre 51 e 200 matrículas de escolarização
50;EM NOSSA SENHORA DAS GROTAS - BOQUEIRAO;29026105;Ativa;Publica;Municipal;48921-000;;POVOADO BOQUEIRAO, ZONA RURAL.;Rural;-9.377819658;-40.29474179;(74) 36178287;;NÃO;Entre 51 e 200 matrículas de escolarização
51;EM NOSSA SENHORA DAS GROTAS - SEDE;29025311;Ativa;Publica;Municipal;48903-267;;RUA RUA DO SOCORRO, S/N PROX. A PC DA MONICA. ALAGADICO.;Urbana;-9.416151;-40.50497;(74) 988145446;;NÃO;Entre 201 e 500 matrículas de escolarização
52;EM NOSSA SENHORA RAINHA DOS ANJOS;29025958;Ativa;Publica;Municipal;48920-899;;FAZENDA LAGOA GRANDE, MANICOBA.;Rural;;;(74) 91957370;;NÃO;Até 50 matrículas de escolarização
53;EM OSORIO TELES DE MENEZES;29025869;Ativa;Publica;Municipal;48922-970;;RUA VERMELHA, S/N CENTRO.;Rural;-9.592821667;-40.41884833;(74) 988590531;;NÃO;Entre 51 e 200 matrículas de escolarização
54;EM PAULO FREIRE;29461359;Ativa;Publica;Municipal;48922-200;;ASSENTAMENTO SAO FRANCISCO - SALITRE DISTRITO DE JUNCO, S/N INTERIOR. SALITRE DISTRITO DE JUNCO.;Rural;-9.48576838;-40.73041238;(74) 36123354;;NÃO;Entre 51 e 200 matrículas de escolarização
55;EM PAULO VI;29024587;Ativa;Publica;Municipal;48904-245;;TRAVESSA PAULO VI, PREDIO. SANTA MARIA GORETTI.;Urbana;-9.419825;-40.499325;(74) 36115675;;NÃO;Entre 501 e 1000 matrículas de escolarização
56;EM PREFEITO APRIGIO DUARTE;29025362;Ativa;Publica;Municipal;48907-201;;RUA B, S/N RESIDENCIAL JUAZEIRO. ITABERABA.;Urbana;-9.449955;-40.47512667;(74) 988320498;;NÃO;Entre 201 e 500 matrículas de escolarização
57;EM PRESIDENTE TANCREDO NEVES;29401600;Ativa;Publica;Municipal;48913-146;;CAMINHO CAMINHO 22, DOM JOSE RODRIGUES.;Urbana;-9.452712634;-40.51335784;(74) 36110037;;NÃO;Entre 501 e 1000 matrículas de escolarização
58;EM PROF CARLOS DA COSTA SILVA;29415160;Ativa;Publica;Municipal;48902-380;;RUA ALMIRANTE TAMANDARE, S/N COUNTRY CLUB.;Urbana;-9.416878;-40.51925;(74) 36110021;;NÃO;Entre 51 e 200 matrículas de escolarização
59;EM PROF JOSE PEREIRA DA SILVA;29405106;Ativa;Publica;Municipal;48906-788;;AVENIDA AVENIDA SAO FRANCISCO, S/N ITABERABA.;Urbana;-9.449707344;-40.48237639;(74) 988542694;;NÃO;Entre 501 e 1000 matrículas de escolarização
60;EM PROF MATILDE COSTA MEDRADO;29025770;Ativa;Publica;Municipal;48922-000;;CARNAIBA DE DENTRO, S/N ZONA RURAL. CARNAIBA DO SERTAO.;Rural;-9.583793333;-40.37273333;(74) 988526535;;NÃO;Entre 51 e 200 matrículas de escolarização
61;EM PROF PEDRO RAYMUNDO RODRIGUES REGO;29025478;Ativa;Publica;Municipal;48900-042;;PRACA PRACA ANTONIO TANURY, PIRANGA.;Urbana;-9.43355759;-40.50829139;(74) 999207201;;NÃO;Entre 501 e 1000 matrículas de escolarização
62;EM PROFª ANTONILA DA FRANCA CARDOSO;29026873;Ativa;Publica;Municipal;48922-400;;LOCALIDADE DE ANGICO,;Rural;;;;;NÃO;Entre 51 e 200 matrículas de escolarização
63;EM PROFª ATANILHA LUZ ARAUJO;29026989;Ativa;Publica;Municipal;48922-600;;RUA DOS BUTINS, S/N PREDIO. MASSAROCA.;Rural;-9.874681;-40.28399;;;NÃO;Entre 51 e 200 matrículas de escolarização
64;EM PROFª BERNADETE BRAGA;29026695;Ativa;Publica;Municipal;48922-200;;POVOADO GANGORRA II, S/N SALITRE.;Rural;-9.82768;-40.621945;;;NÃO;Até 50 matrículas de escolarização
65;EM PROFª CARMEN COSTA SANTOS;29024692;Ativa;Publica;Municipal;48909-241;;AVENIDA IRMA DULCE, S/N ALTO DA ALIANCA.;Urbana;-9.44759701;-40.49795363;;;NÃO;Entre 501 e 1000 matrículas de escolarização
66;EM PROFª CRENILDES LUIZ BRANDAO;29024900;Ativa;Publica;Municipal;48904-115;;RUA RUA ALFREDO NUNES DE OLIVEIRA, S/N COREIA.;Urbana;-9.416252;-40.49656;;;NÃO;Entre 201 e 500 matrículas de escolarização
67;EM PROFª DINORAH ALBERNAZ MELO DA SILVA;29025036;Ativa;Publica;Municipal;48906-798;;RUA RUA PETRONILIO BRITO DOS SANTOS, S/N ITABERABA.;Urbana;-9.44842147;-40.48518834;;;NÃO;Entre 501 e 1000 matrículas de escolarização
68;EM PROFª EDUALDINA DAMASIO;29026709;Ativa;Publica;Municipal;48922-200;;LOCALIDADE CAMPO DOS CAVALOS, S/N SALITRE. JUNCO.;Rural;-9.56177243;-40.65503764;(74) 36123354;;NÃO;Entre 201 e 500 matrículas de escolarização
69;EM PROFª GRACIOSA XAVIER RAMOS GOMES;29025753;Ativa;Publica;Municipal;48922-000;;RUA DA IGREJA, S/N 48922;Rural;-9.433127;-40.50477;(74) 36181029;;NÃO;Entre 201 e 500 matrículas de escolarização
70;EM PROFª GUIOMAR LUSTOSA RODRIGUES;29024838;Ativa;Publica;Municipal;48901-260;;RUA DAS ALGAROBAS, S/N QUIDE.;Urbana;-9.42998473;-40.52323056;;;NÃO;Entre 501 e 1000 matrículas de escolarização
71;EM PROFª HAYDEE FONSECA FALCAO;29024960;Ativa;Publica;Municipal;48914-072;;QUADRA QUADRA 23, S/N JOAO PAULO II.;Urbana;-9.470588802;-40.49805441;(74) 999858835;;NÃO;Entre 501 e 1000 matrículas de escolarização
72;EM PROFª HELENA ARAUJO PINHEIRO;29025575;Ativa;Publica;Municipal;48916-231;;RUA RUA DA SAUDADE, S/N PADRE VICENTE- CODEVASF.;Urbana;-9.441909;-40.50995;(74) 988332875;;NÃO;Entre 201 e 500 matrículas de escolarização
73;EM PROFª HELENA ARAUJO PINHEIRO – EXT;11111112;Ativa;Publica;Municipal;;;;Urbana;;;;;SIM;
74;EM PROFª IRACY NUNES DA SILVA;29341809;Ativa;Publica;Municipal;48924-000;;FELIPE BARROSO, S/N DISTRITO DE ITAMOTINGA.;Rural;-9.097463823;-40.09946125;;;NÃO;Entre 501 e 1000 matrículas de escolarização
75;EM PROFª LEOPOLDINA LEAL;29024978;Ativa;Publica;Municipal;48901-100;;RUA ARNALDO VIEIRA, S/N QUIDE.;Urbana;;;(74) 988236218;;NÃO;Entre 501 e 1000 matrículas de escolarização
76;EM PROFª MARIA AMELIA DE SOUZA OLIVEIRA;29026776;Ativa;Publica;Municipal;48922-200;;COMUNIDADE SABIA II, SALITRE.;Rural;-9.453838333;-40.513045;(74) 91044270;;NÃO;Entre 51 e 200 matrículas de escolarização
77;EM PROFª MARIA DE LOURDES DUARTE;29024943;Ativa;Publica;Municipal;48904-179;;TRAVESSA TRAVESSA BEIJA-FLOR, 151 JARDIM UNIVERSITARIO.;Urbana;-9.419725;-40.49078167;(74) 999460651;;NÃO;Entre 201 e 500 matrículas de escolarização
78;EM PROFª MARIA FRANCA PIRES;29024986;Ativa;Publica;Municipal;48900-310;;RUA ALLAN KARINE, S/N JOAO XXIII.;Urbana;-9.43259462;-40.49971998;(74) 36123354;;NÃO;Entre 501 e 1000 matrículas de escolarização
79;EM PROFª MARIA JOSE LIMA DA ROCHA;29362504;Ativa;Publica;Municipal;48914-140;;QUADRA 9, S/N JOAO PAULO II.;Urbana;-9.475517655;-40.49628097;(74) 36120485;;NÃO;Entre 501 e 1000 matrículas de escolarização
80;EM PROFª MARIA JULIA RODRIGUES TANURI;29476623;Ativa;Publica;Municipal;48918-305;;RUA RUA PROJETADA C, S/N RES DR HUMBERTO. NOVA JUAZEIRO.;Urbana;-9.46130418;-40.53332778;;;NÃO;Entre 501 e 1000 matrículas de escolarização
81;EM PROFª MAZZARELLO CAVALCANTI REIS DA ROCHA;29469120;Ativa;Publica;Municipal;48914-108;;PRACA MISAEL AGUILAR, S/N AVENIDA PRINCIPAL. JOAO PAULO II.;Urbana;-9.473195;-40.49833;;;NÃO;Entre 201 e 500 matrículas de escolarização
82;EM PROFª OSCARLINA TANURI;29026725;Ativa;Publica;Municipal;48922-200;;RUA PRINCIPAL, S/N MANGA II - SALITRE. MANGA II.;Rural;-9.674563212;-40.60533011;;;NÃO;Entre 51 e 200 matrículas de escolarização
83;EM PROFª TEREZINHA FERREIRA DE OLIVEIRA;29025397;Ativa;Publica;Municipal;48906-165;;RUA PARAISO, S/N TABULEIRO.;Urbana;-9.433172867;-40.4757857;;;NÃO;Mais de 1000 matrículas de escolarização
84;EM PROMENOR;29025524;Ativa;Publica;Municipal;48905-231;;RODOVIA RODOVIA LOMANTO JUNIOR KM2, S/N ALTO DO CRUZEIRO.;Urbana;-9.43345454;-40.49659474;(74) 36110246;;NÃO;Entre 201 e 500 matrículas de escolarização
85;EM RAIMUNDO CLEMENTINO DE SOUZA;29027055;Ativa;Publica;Municipal;48924-000;;RUA DA RODOVIA, S/N DISTRITO DE PINHOES.;Rural;-9.578492;-39.8925;(74) 999759179;;NÃO;Entre 201 e 500 matrículas de escolarização
86;EM RAIMUNDO MEDRADO PRIMO;29424445;Ativa;Publica;Municipal;48901-340;;RUA SEBASTIAO ALMEIDA BRANCO, QUIDEZINHO. PEDRA DO LORD.;Urbana;-9.430320966;-40.53358379;(74) 36115726;;NÃO;Entre 51 e 200 matrículas de escolarização
87;EM RURAL DE MASSAROCA;29341779;Ativa;Publica;Municipal;48922-600;;FAZENDA LAGOINHA, S/N PREDIO.;Rural;;;(74) 994436003;;NÃO;Entre 51 e 200 matrículas de escolarização
88;EM RURAL DE TEMPO INTEGRAL SAO JOSE;29469112;Ativa;Publica;Municipal;48923-000;;PROJETO CURACA NH04,;Rural;;;(74) 999646070;;NÃO;Entre 201 e 500 matrículas de escolarização
89;EM SANTA INES;29026288;Ativa;Publica;Municipal;48920-899;;AREA AREA RURAL, AREA RURAL DE JUAZEIRO.;Rural;-9.32969421;-40.29916914;(74) 36123354;;NÃO;Entre 501 e 1000 matrículas de escolarização
90;EM SANTA TEREZINHA - JAZIDA SETE;29026300;Ativa;Publica;Municipal;48920-899;;POVOADO DE JAZIDA, S/N AREA RURAL DE JUAZEIRO.;Rural;;;(74) 88110653;;NÃO;Entre 51 e 200 matrículas de escolarização
91;EM SANTO ANTONIO;29025010;Ativa;Publica;Municipal;48923-000;;PROJETO CURACA NH03, S/N VILA SANTO ANTONIO. ITAMOTINGA.;Rural;-9.14507713;-40.02686413;(74) 36187055;;NÃO;Entre 501 e 1000 matrículas de escolarização
92;EM SAO FRANCISCO DE ASSIS - MULUNGU;29026350;Ativa;Publica;Municipal;48924-000;;MULUNGU- MANICOBA, PROJETO MANICOBA.;Rural;;;;;NÃO;Até 50 matrículas de escolarização
93;EM SAO FRANCISCO DE ASSIS – ITAMOTINGA (NH2);29025982;Ativa;Publica;Municipal;48923-000;;RUA 02, PROJETO CURACA NH2, S/N ITAMOTINGA.;Rural;-9.11589812;-40.06924927;(74) 36189018;;NÃO;Entre 201 e 500 matrículas de escolarização
94;EM SAO JOSE;29026377;Ativa;Publica;Municipal;48921-000;;FAZENDA MATO GROSSO - MANICOBA, S/N;Rural;-9.24311385;-40.29054218;(74) 998183008;;NÃO;Entre 51 e 200 matrículas de escolarização
95;EM SAO SEBASTIAO;29025931;Ativa;Publica;Municipal;48921-000;;POVOADO DE ITAPARICA, S/N MANICOBA.;Rural;-9.109369596;-40.27018265;;;NÃO;Entre 51 e 200 matrículas de escolarização
96;EM VEREADOR AMADEUS DAMASIO;29026520;Ativa;Publica;Municipal;48922-200;;LOCALIDADE SAO GONCALO SALITRE, SALITRE.;Rural;-9.47443285;-40.67809578;(74) 36123354;;NÃO;Entre 51 e 200 matrículas de escolarização
97;EMEI ADJALVA FERREIRA LIMA;29461375;Ativa;Publica;Municipal;48916-693;;RUA A CAMINHO 3, S/N PIRANGA II.;Urbana;-9.443031667;-40.52233167;;;NÃO;Entre 201 e 500 matrículas de escolarização
98;EMEI AMELIA BORGES DE S MARTINS;29025842;Ativa;Publica;Municipal;48922-000;;RUA DOS VERMELHOS, S/N 48922;Rural;;;(74) 36123354;;NÃO;Entre 51 e 200 matrículas de escolarização
99;EMEI AMELIA DUARTE;29402140;Ativa;Publica;Municipal;48914-020;;QUADRA 33, S/N JOAO PAULO II.;Urbana;-9.46801011;-40.49962685;(74) 36123354;;NÃO;Entre 201 e 500 matrículas de escolarização
100;EMEI AMERICO TANURY - ABOBORA;29025699;Ativa;Publica;Municipal;48922-700;;RUA BERTOLINO EVANGELISTA DA CUNHA, S/N DISTRITO DE ABOBORA.;Rural;;;(74) 36179072;;NÃO;Entre 51 e 200 matrículas de escolarização
101;EMEI ANA MARIA MORGADO CHAVES;29401220;Ativa;Publica;Municipal;48906-816;;RUA 2 A, 19 C ITABERABA.;Urbana;;;(74) 36123354;;NÃO;Entre 201 e 500 matrículas de escolarização
102;EMEI ANNA HILDA LEITE FARIA;29402120;Ativa;Publica;Municipal;48900-371;;RUA 4, S/N ALTO DA MARAVILHA.;Urbana;-9.43532014;-40.50603155;;;NÃO;Entre 51 e 200 matrículas de escolarização
103;EMEI ARCENIO JOSE DA SILVA;29429790;Ativa;Publica;Municipal;48922-000;;FAZENDA LAGINHA,;Rural;;;(74) 36123354;;NÃO;Até 50 matrículas de escolarização
104;EMEI ARLINDA ALVES VARJAO;29464064;Ativa;Publica;Municipal;48913-300;;AVENIDA AVENIDA EDESIO SANTOS, 91 PEDRO RAIMUNDO.;Urbana;-9.45820826;-40.51274584;(74) 88333869;;NÃO;Entre 201 e 500 matrículas de escolarização
105;EMEI BEATRIZ ANGELICA MOTA FERREIRA DA SILVA;29470820;Ativa;Publica;Municipal;48904-145;;RUA PROF AGOSTINHO JOSE MUNIZ, S/N PREDIO. SAO GERALDO.;Urbana;-9.41859334;-40.49185435;;;NÃO;Entre 201 e 500 matrículas de escolarização
106;EMEI BOLIVAR SANTANA;29026423;Ativa;Publica;Municipal;48920-899;;VILA JUCA VIANA, PROJETO MANDACARU. AREA RURAL DE JUAZEIRO.;Rural;-9.391816;-40.42939;(74) 88054854;;NÃO;Entre 51 e 200 matrículas de escolarização
107;EMEI BOM JESUS DOS NAVEGANTES;29402170;Ativa;Publica;Municipal;48923-000;;RUA FELIPE BARROSO-DISTRITO DE ITAMOTINA, S/N PREDIO.;Rural;-9.0963468;-40.09817242;(74) 36173029;;NÃO;Entre 51 e 200 matrículas de escolarização
108;EMEI CAIC MISAEL AGUILAR;29932777;Ativa;Publica;Municipal;48916-807;;AVENIDA TANCREDO NEVES, S/N MALHADA DA AREIA.;Urbana;-9.44183094;-40.51309568;;;NÃO;Entre 51 e 200 matrículas de escolarização
109;EMEI DILMA CALMON OLIVEIRA;29402190;Ativa;Publica;Municipal;48901-300;;AVENIDA NOSSA SENHORA DE NAZARE, S/N QUIDE.;Urbana;-9.429883682;-40.52301178;;;NÃO;Entre 51 e 200 matrículas de escolarização
110;EMEI EDIVANIA SANTOS CARDOSO;29461189;Ativa;Publica;Municipal;48900-195;;RUA RUA DA LAGOA, S/N JOAO XXIII.;Urbana;-9.435351667;-40.497885;;;NÃO;Entre 51 e 200 matrículas de escolarização
111;EMEI ELEOTERIO SOARES FONSECA;29341744;Ativa;Publica;Municipal;48924-000;;TRAVESSA DA RODOVIA, S/N DISTRITO DE PINHOES.;Rural;-9.578519;-39.89167;;;NÃO;Até 50 matrículas de escolarização
112;EMEI GENTIL DAMASIO NASCIMENTO;29402100;Ativa;Publica;Municipal;48909-241;;AVENIDA IRMA DULCE, 492 ALTO DA ALIANCA.;Urbana;-9.447268143;-40.49836723;(74) 36133763;;NÃO;Entre 201 e 500 matrículas de escolarização
113;EMEI GENTIL DAMASIO NASCIMENTO – EXT;11111111;Ativa;Publica;Municipal;;;;Urbana;;;;;SIM;
114;EMEI HERBET MOUZE RODRIGUES;29026628;Ativa;Publica;Municipal;48922-200;;CAPIM DE RAIZ, S/N CAPIM DE RAIZ. SALITRE.;Rural;-9.55974118;-40.64592107;(74) 988440784;;NÃO;Entre 51 e 200 matrículas de escolarização
115;EMEI IRMA REDENTA;29461340;Ativa;Publica;Municipal;48913-606;;AVENIDA DOS EVANGELICOS, S/N ANTONIO GUILHERMINO.;Urbana;-9.46225241;-40.49498286;(74) 988054502;;NÃO;Entre 201 e 500 matrículas de escolarização
116;EMEI JANDIRA BORGES DA CUNHA;29402210;Ativa;Publica;Municipal;48906-005;;RUA DAS ALGAROBAS, S/N PREDIO. TABULEIRO.;Urbana;;;(74) 991896668;;NÃO;Entre 51 e 200 matrículas de escolarização
117;EMEI LENI LOPES DE ARAUJO SANTOS;29461367;Ativa;Publica;Municipal;48916-541;;AVENIDA BRILHO DO SOL, S/N PIRANGA I.;Urbana;;;(74) 988299594;;NÃO;Entre 201 e 500 matrículas de escolarização
118;EMEI LUANA DA SILVA NASCIMENTO;29467152;Ativa;Publica;Municipal;48906-826;;TRAVESSA PROJETADA 11, S/N ITABERABA.;Urbana;-9.44536317;-40.48470537;(74) 999555400;;NÃO;Entre 201 e 500 matrículas de escolarização
119;EMEI LUZINETE DE OLIVEIRA;29461219;Ativa;Publica;Municipal;48916-231;;RUA DA SAUDADE, S/N PREDIO. PADRE VICENTE.;Urbana;-9.443105129;-40.51015092;(74) 988549181;;NÃO;Entre 501 e 1000 matrículas de escolarização
120;EMEI MANOEL ALVES MOTA;29461227;Ativa;Publica;Municipal;48923-000;;AVENIDA JORGE KHOURY, S/N MANICOBA. VILA SANTA INES.;Rural;-9.32907287;-40.2994402;(74) 36123354;;NÃO;Entre 51 e 200 matrículas de escolarização
121;EMEI MARIA FERREIRA DE SOUZA;29469635;Ativa;Publica;Municipal;48922-600;;RUA DO MERCADO, S/N PREDIO.;Rural;;;(74) 36141990;;NÃO;Até 50 matrículas de escolarização
122;EMEI MARIA HELENA DA SILVA PEREIRA;29461243;Ativa;Publica;Municipal;48914-156;;QUADRA B, S/N PROXIMO A UBS. PARQUE RESIDENCIAL.;Urbana;-9.47322997;-40.49195638;(74) 988078308;;NÃO;Entre 201 e 500 matrículas de escolarização
123;EMEI MARIA HOZANA NUNES;29461235;Ativa;Publica;Municipal;48900-100;;RUA AMERICO TANURI, S/N JARDIM FLORIDA.;Urbana;-9.42791443;-40.51182754;(74) 991177093;;NÃO;Entre 201 e 500 matrículas de escolarização
124;EMEI MARIA JULIA RODRIGUES TANURI;29461170;Ativa;Publica;Municipal;48905-531;;AVENIDA DAS NACOES, 557 DOM TOMAZ.;Urbana;-9.44042271;-40.48888679;(74) 988067767;;NÃO;Entre 201 e 500 matrículas de escolarização
125;EMEI MARIA VIANA TANURI;29402160;Ativa;Publica;Municipal;48902-690;;AVENIDA GASPAR DE LEMOS, S/N NOSSA SENHORA DA PENHA.;Urbana;-9.419069924;-40.51381853;;;NÃO;Entre 201 e 500 matrículas de escolarização
126;EMEI MARIA VIANA TANURI – EXT;11111113;Ativa;Publica;Municipal;48902-691;;;Urbana;;;;;SIM;
