id;nome;codigo;situacao;cat_administrativa;dep_administrativa;cep;bairro_id;endereco;zona;lat;long;Telefone;email;extensao;porte
127;EMEI NAILDE COSTA;29402150;Ativa;Publica;Municipal;48904-425;;TRAVESSA ALECRIM DOURADO, S/N QD-C. JARDIM NOVO ENCONTRO.;Urbana;-9.421177719;-40.49483294;(74) 36123354;;NÃO;Entre 201 e 500 matrículas de escolarização
128;EMEI NELIA DE SOUZA COSTA;29461197;Ativa;Publica;Municipal;48914-156;;QUADRA 2 RUA G, S/N JOAO PAULO II.;Urbana;-9.477215;-40.49862;;;NÃO;Entre 201 e 500 matrículas de escolarização
129;EMEI NOSSA SENHORA DAS GROTAS;29025788;Ativa;Publica;Municipal;48922-000;;POVOADO DE CARNEIROS, S/N ZONA RURAL. CARNAIBA.;Rural;-9.562585;-40.37110167;(74) 988590531;;NÃO;Até 50 matrículas de escolarização
130;EMEI NOSSO SENHOR DOS AFLITOS;29445256;Ativa;Publica;Municipal;48900-040;;RUA SANTA CLARA, 800 CASA. PIRANGA.;Urbana;-9.43586217;-40.50463318;(74) 36123354;;NÃO;Entre 201 e 500 matrículas de escolarização
131;EMEI PASSAGEM DO SARGENTO;29026792;Ativa;Publica;Municipal;48922-200;;POVOADO PASSAGEM DO SARGENTO, S/N SALITRE.;Rural;-9.885848333;-40.64337667;(74) 36123354;;NÃO;Até 50 matrículas de escolarização
132;EMEI PASTOR MANOEL MARQUES DE SOUZA;29469252;Ativa;Publica;Municipal;48900-020;;RUA DO RISO, S/N PIRANGA.;Urbana;-9.43531037;-40.50574418;(74) 988136212;;NÃO;Entre 51 e 200 matrículas de escolarização
133;EMEI PREFEITO APRIGIO DUARTE;29470811;Ativa;Publica;Municipal;48907-201;;RUA B, S/N RESIDENCIAL JUAZEIRO. ITABERABA.;Urbana;-9.44988;-40.47496167;(74) 988320498;;NÃO;Entre 51 e 200 matrículas de escolarização
134;EMEI PROFª ADELAIDE MOREIRA BISPO;29461251;Ativa;Publica;Municipal;48908-536;;RUA DA PAZ, JARDIM PRIMAVERA.;Urbana;-9.45505827;-40.41689956;(74) 988186050;;NÃO;Entre 51 e 200 matrículas de escolarização
135;EMEI PROFª HELOISA HELENA BENEVIDES FARIAS;29402110;Ativa;Publica;Municipal;48901-665;;RUA AURENILDES GONCALVES DA CUNHA, S/N PALMARES.;Urbana;-9.427825673;-40.52718898;;;NÃO;Entre 201 e 500 matrículas de escolarização
136;EMEI PROFª JOANA RAMOS;29026261;Ativa;Publica;Municipal;48923-000;;POVOADO PERIQUITO, S/N ITAMOTINGA.;Rural;-9.09831657;-40.01104478;(74) 36189018;;NÃO;Até 50 matrículas de escolarização
137;EMEI PROFª MARIA SUELY MEDRADO ARAUJO;29025338;Ativa;Publica;Municipal;48906-130;;RUA 9, 30 ESCOLA. TABULEIRO.;Urbana;;;(74) 991896668;;NÃO;Entre 51 e 200 matrículas de escolarização
138;EMEI PROFª VANDA GUERRA;29476615;Ativa;Publica;Municipal;48917-137;;RUA RUA DAS ALGAROBAS, S/N ANTONIO CONSELHEIRO.;Urbana;-9.44851533;-40.52127523;(74) 988110737;;NÃO;Entre 201 e 500 matrículas de escolarização
